{
  "entityType": "Character",
  "identifier": [
    {
      "identifierValue": "1234",
      "identifierScope": "Movielabs"
    }
  ],
  "name": "Sven",
  "description": "An unassuming satellite repair man",
  "Context": {
    "entityType": "Context",
    "identifier": [
      {
        "identifierValue": "5678",
        "identifierScope": "Movielabs"
      }
    ],
    "isPortrayedBy": {
      "Participant": {
        "entityType": "Participant",
        "identifier": [
          {
            "identifierValue": "5678",
            "identifierScope": "Movielabs"
          }
        ],
        "name": "J. Warren Trezevant",
        "description": "Stunt actor doing mo-cap for Sven",
        "structuralCharacteristics": {
          "structuralType": "person"
        },
        "functionalCharacteristics": {
          "functionalType": "stunts"
        },
        "Context": {
          "entityType": "Context",
          "identifier": [
            {
              "identifierValue": "9786",
              "identifierScope": "Movielabs"
            }
          ],
          "portrays": {
            "entityType": "Character",
            "identifier": [
              {
                "identifierValue": "1234",
                "identifierScope": "Movielabs"
              }
            ]
          }
        }
      }
    }
  }
}